{"schema":"sdp-governance-overview/1","projectRef":"pg-owner-lab","root":"/home/warloc/git/pg_lab","checkoutId":"e499e843-c777-40ae-a90c-f4e4836af842","generation":"a6db29e0f60ebe1b70762c474346af462ce493913faf8da14b6008fa4228b87f","inspectedAt":"2026-10-24T08:52:19.109151305Z","scope":"registered-runs-in-selected-checkout","runs":[{"runId":"be00db9f-4e12-4d8e-8728-9fa367450065","revision":24,"outcome":"Implement and test FormatLabel in the native PG lab, then report for Project Leader processing","selection":{"card":"SDP/KanBan/active/leader-trial.md","plan":"SDP/Maintenance/LeaderTrial/Plan.md","session":"SDP/Sessions/leader-trial.md","authority":"SDP/leader-trial-authority.md","step":"S1"},"inputRevision":"73390a48f39fd65e6d0d428df1fcb3f3d61f9ed7de82818968308b2629c703f9","routineState":"verifying","routineStep":"implement","coverage":"known","conditions":[],"assignedRole":"Master","roleEvidence":"observed","attemptId":"450e0fa0-9684-4f6b-990b-bc17a5daa979","threadId":"01a16d18-462e-7631-a8fe-b3b4ff6d97c1","turnId":"01a16d18-467a-7070-ae9d-a12429c85f9c","lastHostStatus":"completed","lastObservedAt":"2026-10-24T08:48:49.841135961Z","observationGap":false,"liveState":"unknown","toolCompletions":8,"lastToolItemId":"exec-b67f2af7-57bf-412a-8c56-c9b2be5bc98c","lastToolStatus":"completed","childMapping":"not-observed","requestedSkills":1,"skillAttemptId":"450e0fa0-9684-4f6b-990b-bc17a5daa979","skillInputId":"4bae5a3f-1584-4b92-a795-479fe2c5a8ec","skillAcceptance":"host-message-observed","skillCompliance":"not-observed","ownerAcceptance":"not-observed"}]}
